{"case_id":"qc_006","excerpt_policy":"固定规则选两个原始完整编码gene块和所有关联完整蛋白；仅格式重排LF/FAA60列，不代表完整基因组；确定性变体逐字段记录。","historical_rule_report_seen":true,"injection_script":"bench/newsource_validation/cases.py","mechanism_exposure":"seen_in_project_development","mechanism_family":"protein_identifier_connection","pair_id":"NSP1","pressure_parent":null,"review_status":"draft","schema_version":"newsource-case-1","seed":20261011,"source_exposure":"new_to_model_prompt_tool_development","source_files":[{"path":"sources/GCF_059516105.1_RoL_Sflo_1.0_genomic.gff.gz","selection":"{\"gene_ids\": [\"gene-syt4\", \"gene-sema4f\"], \"policy\": {\"answer_status\": \"draft\", \"api_calls\": 0, \"artifact_read_pages_maximum\": 4, \"candidate_limit\": 50, \"candidate_limit_definition\": \"first 50 eligible blocks, not first 50 raw genes\", \"case_order\": \"sort SHA256(seed|accession|variant) then assign qc_NNN\", \"genes_selected\": 2, \"max_feature_rows_per_gene\": 40, \"max_visible_bytes\": 30000, \"normal_scope\": \"only declared closed connected coding subset\", \"page_bytes\": 16000, \"page_lines\": 200, \"require_multisegment_cds\": true, \"same_source_pairs\": true, \"seed\": 20261011, \"selection_order\": \"source GFF order; first two individually closed, connected eligible coding blocks within byte limit\"}, \"transform\": {\"after\": \"XP_088235420.101\", \"attribute\": \"protein_id\", \"before\": \"XP_088235420.1\", \"policy\": \"all segments of one CDS; no other field changes\"}}","sha256":"044913a4a5458be9f427f8d3ab0d94dd0339f958195a263be075722ec4d0758c","source_group":"GCF_059516105.1","source_origin":"/home/Lianjunyang/临时/GCF_059516105.1_RoL_Sflo_1.0_genomic.gff.gz"},{"path":"sources/GCF_059516105.1_RoL_Sflo_1.0_protein.faa.gz","selection":"{\"gene_ids\": [\"gene-syt4\", \"gene-sema4f\"], \"policy\": {\"answer_status\": \"draft\", \"api_calls\": 0, \"artifact_read_pages_maximum\": 4, \"candidate_limit\": 50, \"candidate_limit_definition\": \"first 50 eligible blocks, not first 50 raw genes\", \"case_order\": \"sort SHA256(seed|accession|variant) then assign qc_NNN\", \"genes_selected\": 2, \"max_feature_rows_per_gene\": 40, \"max_visible_bytes\": 30000, \"normal_scope\": \"only declared closed connected coding subset\", \"page_bytes\": 16000, \"page_lines\": 200, \"require_multisegment_cds\": true, \"same_source_pairs\": true, \"seed\": 20261011, \"selection_order\": \"source GFF order; first two individually closed, connected eligible coding blocks within byte limit\"}, \"transform\": {\"after\": \"XP_088235420.101\", \"attribute\": \"protein_id\", \"before\": \"XP_088235420.1\", \"policy\": \"all segments of one CDS; no other field changes\"}}","sha256":"36dcd8f4df1a97c8bf573bc0a44f6a8de2d3de4d633eac0b7260a260da8f4ccd","source_group":"GCF_059516105.1","source_origin":"/home/Lianjunyang/临时/GCF_059516105.1_RoL_Sflo_1.0_protein.faa.gz"}],"source_group":"GCF_059516105.1","split":"sealed_test","stage":"structural_annotation","synthetic":true,"type":"fault","verbatim_tool_exceptions":[],"visible_contract":{"allowed_id_mapping":"exact only","artifact_roles":{"delivery":["artifacts/models.gff3","artifacts/proteins.faa","artifacts/record_counts.json"],"reference":[]},"consumer_contract":"完整Parent层级、同序列/链、闭区间包含、protein_id精确连接FAA首token","review_target":"input","scope":"declared_subset","usable_previous_result":false}}
