{"case_id":"qc_004","excerpt_policy":"固定规则选两个原始完整编码gene块和所有关联完整蛋白；仅格式重排LF/FAA60列，不代表完整基因组；确定性变体逐字段记录。","historical_rule_report_seen":true,"injection_script":"bench/newsource_validation/cases.py","mechanism_exposure":"seen_in_project_development","mechanism_family":"parent_reference_closure","pair_id":"NSP2","pressure_parent":null,"review_status":"draft","schema_version":"newsource-case-1","seed":20261011,"source_exposure":"new_to_model_prompt_tool_development","source_files":[{"path":"sources/GCF_947243775.1_Skud-IFO1802_genomic.gff.gz","selection":"{\"gene_ids\": [\"gene-SKDI_01G0410\", \"gene-SKDI_01G0700\"], \"policy\": {\"answer_status\": \"draft\", \"api_calls\": 0, \"artifact_read_pages_maximum\": 4, \"candidate_limit\": 50, \"candidate_limit_definition\": \"first 50 eligible blocks, not first 50 raw genes\", \"case_order\": \"sort SHA256(seed|accession|variant) then assign qc_NNN\", \"genes_selected\": 2, \"max_feature_rows_per_gene\": 40, \"max_visible_bytes\": 30000, \"normal_scope\": \"only declared closed connected coding subset\", \"page_bytes\": 16000, \"page_lines\": 200, \"require_multisegment_cds\": true, \"same_source_pairs\": true, \"seed\": 20261011, \"selection_order\": \"source GFF order; first two individually closed, connected eligible coding blocks within byte limit\"}, \"transform\": {\"after\": \"gene-SKDI_01G0410_1\", \"attribute\": \"Parent\", \"before\": \"gene-SKDI_01G0410\", \"policy\": \"one mRNA edge; other rows unchanged\"}}","sha256":"486f543d1c5fb5aa34546e902ca290e32799015504c94091bf8de632bc66a3cc","source_group":"GCF_947243775.1","source_origin":"/home/Lianjunyang/临时/GCF_947243775.1_Skud-IFO1802_genomic.gff.gz"},{"path":"sources/GCF_947243775.1_Skud-IFO1802_protein.faa.gz","selection":"{\"gene_ids\": [\"gene-SKDI_01G0410\", \"gene-SKDI_01G0700\"], \"policy\": {\"answer_status\": \"draft\", \"api_calls\": 0, \"artifact_read_pages_maximum\": 4, \"candidate_limit\": 50, \"candidate_limit_definition\": \"first 50 eligible blocks, not first 50 raw genes\", \"case_order\": \"sort SHA256(seed|accession|variant) then assign qc_NNN\", \"genes_selected\": 2, \"max_feature_rows_per_gene\": 40, \"max_visible_bytes\": 30000, \"normal_scope\": \"only declared closed connected coding subset\", \"page_bytes\": 16000, \"page_lines\": 200, \"require_multisegment_cds\": true, \"same_source_pairs\": true, \"seed\": 20261011, \"selection_order\": \"source GFF order; first two individually closed, connected eligible coding blocks within byte limit\"}, \"transform\": {\"after\": \"gene-SKDI_01G0410_1\", \"attribute\": \"Parent\", \"before\": \"gene-SKDI_01G0410\", \"policy\": \"one mRNA edge; other rows unchanged\"}}","sha256":"d1428a911d6cbca9cdf27225ca4f750b56daf32878e86390930ade2f5e160429","source_group":"GCF_947243775.1","source_origin":"/home/Lianjunyang/临时/GCF_947243775.1_Skud-IFO1802_protein.faa.gz"}],"source_group":"GCF_947243775.1","split":"sealed_test","stage":"structural_annotation","synthetic":true,"type":"fault","verbatim_tool_exceptions":[],"visible_contract":{"allowed_id_mapping":"exact only","artifact_roles":{"delivery":["artifacts/models.gff3","artifacts/proteins.faa","artifacts/record_counts.json"],"reference":[]},"consumer_contract":"完整Parent层级、同序列/链、闭区间包含、protein_id精确连接FAA首token","review_target":"input","scope":"declared_subset","usable_previous_result":false}}
