{"case_id":"qc_011","excerpt_policy":"固定规则选两个原始完整编码gene块和所有关联完整蛋白；仅格式重排LF/FAA60列，不代表完整基因组；确定性变体逐字段记录。","historical_rule_report_seen":true,"injection_script":"bench/newsource_validation/cases.py","mechanism_exposure":"seen_in_project_development","mechanism_family":"protein_identifier_connection","pair_id":"NSP4","pressure_parent":null,"review_status":"draft","schema_version":"newsource-case-1","seed":20261011,"source_exposure":"new_to_model_prompt_tool_development","source_files":[{"path":"sources/GCF_027887165.2_mMonDom1.pri_genomic.gff.gz","selection":"{\"gene_ids\": [\"gene-LOC130453517\", \"gene-LOC130453802\"], \"policy\": {\"answer_status\": \"draft\", \"api_calls\": 0, \"artifact_read_pages_maximum\": 4, \"candidate_limit\": 50, \"candidate_limit_definition\": \"first 50 eligible blocks, not first 50 raw genes\", \"case_order\": \"sort SHA256(seed|accession|variant) then assign qc_NNN\", \"genes_selected\": 2, \"max_feature_rows_per_gene\": 40, \"max_visible_bytes\": 30000, \"normal_scope\": \"only declared closed connected coding subset\", \"page_bytes\": 16000, \"page_lines\": 200, \"require_multisegment_cds\": true, \"same_source_pairs\": true, \"seed\": 20261011, \"selection_order\": \"source GFF order; first two individually closed, connected eligible coding blocks within byte limit\"}, \"transform\": \"unmodified source subset\"}","sha256":"b2e2dea345ed4e390159dd9f2ca5db95203a8c9210d9dbdef218dc23f07755fd","source_group":"GCF_027887165.2","source_origin":"/home/Lianjunyang/临时/GCF_027887165.2_mMonDom1.pri_genomic.gff.gz"},{"path":"sources/GCF_027887165.2_mMonDom1.pri_protein.faa.gz","selection":"{\"gene_ids\": [\"gene-LOC130453517\", \"gene-LOC130453802\"], \"policy\": {\"answer_status\": \"draft\", \"api_calls\": 0, \"artifact_read_pages_maximum\": 4, \"candidate_limit\": 50, \"candidate_limit_definition\": \"first 50 eligible blocks, not first 50 raw genes\", \"case_order\": \"sort SHA256(seed|accession|variant) then assign qc_NNN\", \"genes_selected\": 2, \"max_feature_rows_per_gene\": 40, \"max_visible_bytes\": 30000, \"normal_scope\": \"only declared closed connected coding subset\", \"page_bytes\": 16000, \"page_lines\": 200, \"require_multisegment_cds\": true, \"same_source_pairs\": true, \"seed\": 20261011, \"selection_order\": \"source GFF order; first two individually closed, connected eligible coding blocks within byte limit\"}, \"transform\": \"unmodified source subset\"}","sha256":"4ae6d4f54b75f20f748daac68994762af2a43b1fde4fc9c9b774d4a9ebb47a41","source_group":"GCF_027887165.2","source_origin":"/home/Lianjunyang/临时/GCF_027887165.2_mMonDom1.pri_protein.faa.gz"}],"source_group":"GCF_027887165.2","split":"sealed_test","stage":"structural_annotation","synthetic":true,"type":"normal","verbatim_tool_exceptions":[],"visible_contract":{"allowed_id_mapping":"exact only","artifact_roles":{"delivery":["artifacts/models.gff3","artifacts/proteins.faa","artifacts/record_counts.json"],"reference":[]},"consumer_contract":"完整Parent层级、同序列/链、闭区间包含、protein_id精确连接FAA首token","review_target":"input","scope":"declared_subset","usable_previous_result":false}}
